Title,Subreddit,Author,Score,Comments
Dog Protecting His Human,gifs,throatfrog,26957,668
Hello Reddit! I am actor and artist Val Kilmer. I have been Doc Holliday, Mark Twain, Batman, Madmartigan, Iceman, and Real Genius Chris Knight to name a few roles. Today, celebrate the 31st birthday of Top Gun with me as well. AMA,movies,OfficialValKilmer,8276,574
No more religious exemptions: Montreal is taxing churches,atheism,bilalhouri,16518,407
Gift giving troll,funny,hate_mail,20150,583
Thailand threatens to sue Facebook after videos emerge of king in crop top wandering in German shopping centre,nottheonion,shrine,15861,629
That one goth friend,aww,GallowBoob,33410,462
OMFG MY FRIEND'S BROTHER JUST GOT A FIDGET SPINNER HAIRCUT,Justfuckmyshitup,PinelyYT,10951,272
Metal gatekeeping with a dose of quit your bullshit,gatekeeping,twinksteverogers,11001,632
The King of Thailand is suing Facebook to keep photos like this of him in a crop top offline.,pics,Reallttle,80884,786
I think I'm done with Bill Nye. His new show sucks.,television,Sloth859,36215,841
Trump once demanded Edward Snowden’s execution for giving ‘serious information’ to Russia,politics,John-Farson,17546,485
Sally Yates: Russians had 'real leverage' over Michael Flynn,politics,pkvam,19532,664
Donald Trump 'not even aware of where intelligence was from' before telling Russia, White House reveals,worldnews,Lu98ish,13706
Arnold Schwarzenegger the day he became a United States Citizen (1983),OldSchoolCool,_-___-_---_-__---_--,12879,416
More Americans support Trump's impeachment than oppose it for first time, poll finds,politics,saucytryhard,44131
Nest Building Timelapse,NatureIsFuckingLit,Smijaa,15267,293
Evolution of the Hercules Beetle,WTF,retsubhtma,32342,632
This Arby's has a plaque for a customer that died,mildlyinteresting,badbagel37,17678,523
Trump supporters right now,PoliticalHumor,omidelf,30431,710
The Boston Celtics will select the 1st in the 2017 NBA Draft,nba,xvntf,4005,712
Comey Memo Says Trump Asked Him to End Flynn Investigation.,esist,SallyYatesIsAHero,18817,539
You name it!,MarchAgainstTrump,NovaMagazine,11950,474
Comey Memo Says Trump Asked Him to End Flynn Investigation,politics,VisionLikeAHawk,57617,938
Playboy model Dani Mathers faces jail after secretly Snapchatting photo of naked woman at gym,news,AbduIIa,28209,722
Trump defends 'right' to share secrets - BBC News,worldnews,Theodoxx,35173,862
We love too..,quityourbullshit,Tyshio_dan,11681,487
There are no secrets,AdviceAnimals,Lot_Lizard_Lover,27938,585
